author,journal,year,document_type,doi,url,pubmed_id,author_keywords,mesh_terms,keywords,publication_type,title,abstract
Costa-Lima JFD and Pimentel LMLM and Santos FCF and Salazar MP and Duarte RS and Mello FCQ and Schindler HC,Revista da Sociedade Brasileira de Medicina Tropical,2020,NA,10.1590/0037-8682-0051-2020,NA,32997049,NA,"Adolescent and Brazil and Case-Control Studies and Child and Child, Preschool and Diagnostic Tests, Routine and Female and Humans and Infant and Infant, Newborn and Male and Mycobacterium tuberculosis/genetics/*isolation & purification and Polymerase Chain Reaction and Prospective Studies and Tuberculosis, Pulmonary/blood/*diagnosis/urine",NA,Journal Article,Rapid detection of Mycobacterium tuberculosis in children using blood and urine specimens.,"INTRODUCTION: Laboratory and clinical features of childhood tuberculosis (TB) are non-specific and establishing an accurate diagnosis remains a challenge. This study evaluated a Single tube nested-PCR (STNPCR) to detect genomic DNA of Mycobacterium tuberculosis complex in blood and urine. METHODS: Biological samples were obtained from children (<15 years old) with clinical suspicion of pulmonary and extrapulmonary TB at public hospitals in Recife-Pernambuco, Brazil. Cultures yielded negative results in a majority of childhood TB cases, which are generally paucibacillary. A set of clinical, epidemiological, radiological, and laboratory criteria with evident clinical improvement after anti-TB treatment were frequently used to define childhood TB cases. RESULTS: Ninety children with clinical suspicion were enrolled in this study (44 with TB and 46 without TB). The pulmonary TB group had 20 confirmed cases and 46 negative controls, while the extrapulmonary TB group had 24 confirmed cases. The STNPCR showed sensitivities to pulmonary and extrapulmonary TB of 47.4% and 52.2% (blood) and 38.8% and 20% (urine), respectively. Considering the low performance of STNPCR on separate samples, we decided to perform a combined analysis (parallel sensitivity analysis) of the results from blood and urine samples. The parallel sensitivity increased to 65% in blood and 62.5% in urine. The specificity in both samples ranged from 93.5-97.8%. CONCLUSIONS: Although STNPCR showed moderate sensitivity, the specificity is high; therefore, the test can be used as an auxiliary tool to diagnose TB in children. It is a rapid test that demonstrated better performance than other diagnostic tests in paucibacillary samples as it does in childhood tuberculosis."
Lima JF and Guedes Gde M and Lima JF and Lira LA and Santos FC and Arruda ME and Montenegro LM and Schindler HC,Revista da Sociedade Brasileira de Medicina Tropical,2015,NA,10.1590/0037-8682-0210-2015,NA,26676498,NA,"Adolescent and Adult and Aged and *DNA, Bacterial/blood/urine and Female and Humans and Male and Middle Aged and Mycobacterium tuberculosis/genetics/*isolation & purification and Polymerase Chain Reaction/*methods and Reproducibility of Results and Sensitivity and Specificity and Tuberculosis/*diagnosis and Young Adult",NA,"Journal Article and Research Support, N.I.H., Extramural and Research Support, Non-U.S. Gov't",Single-tube nested PCR assay with in-house DNA extraction for Mycobacterium tuberculosis detection in blood and urine.,"INTRODUCTION: Molecular analyses are auxiliary tools for detecting Koch's bacilli in clinical specimens from patients with suspected tuberculosis (TB). However, there are still no efficient diagnostic tests that combine high sensitivity and specificity and yield rapid results in the detection of TB. This study evaluated single-tube nested polymerase chain reaction (STNPCR) as a molecular diagnostic test with low risk of cross contamination for detecting Mycobacterium tuberculosis in clinical samples. METHODS: Mycobacterium tuberculosis deoxyribonucleic acid (DNA) was detected in blood and urine samples by STNPCR followed by agarose gel electrophoresis. In this system, reaction tubes were not opened between the two stages of PCR (simple and nested). RESULTS: STNPCR demonstrated good accuracy in clinical samples with no cross contamination between microtubes. Sensitivity in blood and urine, analyzed in parallel, was 35%-62% for pulmonary and 41%-72% for extrapulmonary TB. The specificity of STNPCR was 100% in most analyses, depending on the type of clinical sample (blood or urine) and clinical form of disease (pulmonary or extrapulmonary). CONCLUSIONS: STNPCR was effective in detecting TB, especially the extrapulmonary form for which sensitivity was higher, and had the advantage of less invasive sample collection from patients for whom a spontaneous sputum sample was unavailable. With low risk of cross contamination, the STNPCR can be used as an adjunct to conventional methods for diagnosing TB."
Lyu L and Li Z and Pan L and Jia H and Sun Q and Liu Q and Zhang Z,BMC infectious diseases,2020,NA,10.1186/s12879-020-05375-y,NA,32894079,NA,"Adolescent and Adult and Aged and DNA Transposable Elements/*genetics and DNA, Bacterial/blood/*genetics and Data Accuracy and Female and Humans and Male and Middle Aged and Mycobacterium tuberculosis/*genetics and Real-Time Polymerase Chain Reaction/*methods and Sensitivity and Specificity and Tuberculosis, Pulmonary/*diagnosis and Young Adult",Cell-free DNA and Digital PCR and IS1081 and IS6110 and Tuberculosis,Journal Article,Evaluation of digital PCR assay in detection of M.tuberculosis IS6110 and IS1081 in tuberculosis patients plasma.,"BACKGROUND: Tuberculosis is still a significant diagnostic and therapeutic challenge with high proportion of smear- and culture- negative incidences worldwide. The conventional diagnostic tests are time-consuming and have a low sensitivity. Digital PCR is a novel technology which can detect target sequences with relatively low abundance and obtain the absolute copy numbers of the targets. METHODS: We assessed the accuracy of dPCR in TB diagnosis using more than 250 specimens, and for the first time, we selected M.tuberculosis-specific IS1081 in addition to widely used IS6110 as the amplification targets for dPCR. The quantification of target DNA was calculated using QuantaSoft Version 1.7.4.0917 (BioRad), and SPSS version 13.0 software (SPSS Inc., Chicago, IL, USA) was used for statistical analyses. RESULTS: IS6110-dPCR was more sensitive than IS1081, with the sensitivity and specificity accounting for 40.6 and 93.4% respectively. When we classified the TB patients by personal factors for high copy number of M.tuberculosis derived DNA in plasma: bilateral TB, extrapulmonary TB and disseminated TB, the sensitivity of both IS6110- and IS1081- dPCR was the highest in patients with disseminated TB (IS6110, 100%; IS1081, 68.8%), while their sensitivity was a bit higher in patients with extrapulmonary TB (IS6110, 50.0%; IS1081, 39.3%) than that in bilateral TB (IS6110, 43.3%; IS1081, 33.3%). Compared with traditional TB diagnostic tests, joint detection IS6110 & IS1081-dPCR was not as sensitive as smear microscope or mycobacterial culture, but it was higher than IS6110 qPCR (p<0.05) and was able to detect 47.4% of smear-negative TB patients. CONCLUSION: Our study suggested that plasma IS6110-dPCR is a rapid, moderate accurate and less-invasive method to detect M.tuberculosis DNA in plasma of TB patients and IS6110 & IS1081-dPCR has a potential to aid diagnosis of smear-negative TB."
Rebollo MJ and San Juan Garrido R and Folgueira D and Palenque E and Daz-Pedroche C and Lumbreras C and Aguado JM,Diagnostic microbiology and infectious disease,2006,NA,10.1016/j.diagmicrobio.2006.03.018,NA,16698218,NA,Antitubercular Agents/therapeutic use and HIV Infections and Humans and Mycobacterium tuberculosis/isolation & purification and Polymerase Chain Reaction/*methods and Sensitivity and Specificity and Tuberculosis/*blood/diagnosis/drug therapy/*urine,NA,Journal Article,Blood and urine samples as useful sources for the direct detection of tuberculosis by polymerase chain reaction.,"The aim of the study was to assess the utility of the polymerase chain reaction (PCR) assay in blood and urine for the diagnosis of tuberculosis (TB). We prospectively evaluated the usefulness of PCR performed in blood and urine samples from patients with proved or probable TB compared with a control group of patients. The PCR technique was performed using IS6110 primers. We included in the study 57 patients (43 with definite TB and 14 with probable TB) and 26 controls. Blood and urine samples were drawn at the time of microbiologic diagnosis and 3, 6, 9, and 12 months later. Cultures were positive in the early period (<1 month after treatment) in 11 of 57 patients (19%) with probable or definite TB, in comparison with 42% of patients (24/57) who yielded a positive PCR (P = 0.02). Urine samples increased the sensitivity of PCR determination in blood samples by 10%. The PCR in blood and/or urine was positive in 41% of patients with pulmonary TB, in 36% of patients with extrapulmonary TB, and in 50% of patients with disseminated TB. Mycobacterium tuberculosis was still detectable by PCR in 5 of 13 patients with cured TB after 1 or more months of antituberculous treatment. The PCR detection of M. tuberculosis in blood and urine samples is useful for the diagnosis of different clinical forms of TB, mostly in those patients in which sample extraction is difficult or requires aggressive techniques. The sensitivity of this technique could be improved studying more than 1 sample in each patient, even after initiating an antituberculous treatment."
Tebruegge M and Ritz N and Koetz K and Noguera-Julian A and Seddon JA and Welch SB and Tsolia M and Kampmann B,PloS one,2014,NA,10.1371/journal.pone.0099129,NA,24922084,NA,"Europe and Hospitals, Pediatric/statistics & numerical data and Immunologic Tests/*statistics & numerical data and Molecular Diagnostic Techniques/*statistics & numerical data and Polymerase Chain Reaction/statistics & numerical data and Tuberculosis/*diagnosis",NA,"Journal Article and Research Support, Non-U.S. Gov't",Availability and use of molecular microbiological and immunological tests for the diagnosis of tuberculosis in europe.,"INTRODUCTION: Currently only limited data exist regarding the availability and clinical use of molecular and immunological tests for tuberculosis (TB) in the European setting. METHODS: Web-based survey of Paediatric-Tuberculosis-Network-European-Trialsgroup (ptbnet) and Tuberculosis-Network-European-Trialsgroup (TBnet) members conducted June to December 2013. Both networks comprise clinicians, microbiologists, epidemiologists and researchers predominately based in Europe. RESULTS: 191 healthcare professionals from 31 European countries participated. Overall, 26.8% of respondents did not have access to the Xpert MTB/RIF assay; only 44.6% had access to the assay in-house. However, a substantial proportion had access to other commercial and/or non-commercial PCR-based assays for TB (68.8% and 31.8%, respectively). Only 6.4% did not have access to any PCR-based assays for TB. A large proportion of participants with access to the Xpert MTB/RIF assay had used it for the analysis of non-respiratory samples [pleural fluid: 36.5%, gastric aspirates: 34.7%, cerebrospinal fluid: 34.7%, stool samples: 4.3%, blood/serum: 2.6%, 'other samples' (which included biopsy/tissue samples, lymph node aspirates, joint aspirates and urine samples): 16.5%]. Regarding interferon-gamma release assays, a greater proportion of respondents had access to the QuantiFERON-TB Gold assay (84.7%) than to the T-SPOT.TB assay (52.2%). CONCLUSIONS: Both immunological and molecular TB tests are widely available across Europe. The QuantiFERON-TB Gold assay is more widely used than the T-SPOT.TB assay, which may reflect the difficulties of integrating an ELISPOT assay into the routine laboratory setting. Although Xpert MTB/RIF assays are optimised and solely licensed for the analysis of sputum samples, in clinical practice they are commonly used for non-respiratory samples. Further research is needed to establish how current molecular TB tests impact on patient care and outcome in the routine clinical setting."
Feasey NA and Banada PP and Howson W and Sloan DJ and Mdolo A and Boehme C and Chipungu GA and Allain TJ and Heyderman RS and Corbett EL and Alland D,Journal of clinical microbiology,2013,NA,10.1128/JCM.00330-13,NA,23678061,NA,Adult and Bacteremia/*diagnosis and Bacteriological Techniques/*methods and Cohort Studies and Female and HIV Infections/*complications and Humans and Malawi and Male and Middle Aged and Molecular Diagnostic Techniques/*methods and Mycobacterium tuberculosis/genetics/*isolation & purification and Predictive Value of Tests and Prognosis and Prospective Studies and Sensitivity and Specificity and Survival Analysis and Tuberculosis/*diagnosis,NA,"Evaluation Study and Journal Article and Research Support, Non-U.S. Gov't",Evaluation of Xpert MTB/RIF for detection of tuberculosis from blood samples of HIV-infected adults confirms Mycobacterium tuberculosis bacteremia as an indicator of poor prognosis.,"Tuberculosis (TB) remains a leading cause of death among HIV-infected adults, in part because of delayed diagnosis and therefore delayed initiation of treatment. Recently, the Gene-Xpert platform, a rapid, PCR-based diagnostic platform, has been validated for the diagnosis of TB with sputum. We have evaluated the Xpert MTB/RIF assay for the diagnosis of Mycobacterium tuberculosis bacteremia and investigated its impact on clinical outcomes. Consecutive HIV-infected adults with fever and cough presenting to Queen Elizabeth Central Hospital, Blantyre, Malawi, were recruited and followed up for 2 months. At presentation, three sputum samples were examined by smear, culture, and Xpert MTB/RIF assay for the presence of M. tuberculosis and blood was drawn for PCR with Xpert, for mycobacterial culture (Myco/F Lytic), and for aerobic culture. One hundred four patients were recruited, and 44 (43%) were sputum culture positive for M. tuberculosis. Ten were Xpert blood positive, for a sensitivity of 21% and a specificity of 100%. The 2-week mortality rate was significantly higher among patients who were Xpert blood positive than among those who were negative (40% versus 3%; multivariate odds ratio [OR] for death if positive, 44; 95% confidence interval [CI], 3 to 662). This effect persisted on assessment of the mortality rate at 2 months (40% versus 11%; OR, 5.6; 95% CI, 1.3 to 24.6). When screening uncomplicated patients presenting with a productive cough for pulmonary TB, Xpert blood offers no diagnostic advantage over sputum testing. Despite this, Xpert blood positivity is highly predictive of early death and this test rapidly identifies a group of patients in urgent need of initiation of treatment."
Schluger NW and Condos R and Lewis S and Rom WN,"Lancet (London, England)",1994,NA,10.1016/s0140-6736(94)92999-8,NA,7913158,NA,"DNA, Bacterial/*blood/genetics and Gene Amplification and Humans and Mycobacterium tuberculosis/*genetics and *Polymerase Chain Reaction and Tuberculosis, Pulmonary/*diagnosis/microbiology",NA,"Journal Article and Research Support, U.S. Gov't, P.H.S.",Amplification of DNA of Mycobacterium tuberculosis from peripheral blood of patients with pulmonary tuberculosis.,"Sputum examination for rapid diagnosis of pulmonary tuberculosis is not always satisfactory. We examined peripheral blood with the polymerase chain reaction (PCR). Blood samples were collected from 8 consecutive patients with suspected pulmonary tuberculosis and from 18 healthy controls, half of whom were tuberculin skin-test positive. All 8 patients had evidence of circulating Mycobacterium tuberculosis DNA in the lymphocyte fraction of peripheral blood, and positive sputum cultures indicating active pulmonary tuberculosis. None of the healthy controls had positive PCR results. This PCR technique may prove useful for the rapid diagnosis of tuberculosis."
Scherer LC and Sperhacke RD and Jarczewski C and Cafrune PI and Michelon CT and Rupenthal R and Ribeiro MO and Netto AR and Rossetti ML and Kritski AL,BMC pulmonary medicine,2011,NA,10.1186/1471-2466-11-15,NA,21447159,NA,"Adult and Aged and Aged, 80 and over and Antibodies, Viral/blood and Brazil/epidemiology and Comorbidity and DNA, Bacterial/genetics and HIV Infections/diagnosis/*epidemiology and HIV-1/immunology and HIV-2/immunology and Humans and Middle Aged and Mycobacterium tuberculosis/genetics and Polymerase Chain Reaction/*methods and Prevalence and Prospective Studies and Retrospective Studies and Sensitivity and Specificity and Tuberculosis, Pulmonary/*diagnosis/*epidemiology",NA,"Comparative Study and Journal Article and Multicenter Study and Research Support, Non-U.S. Gov't",Comparison of two laboratory-developed PCR methods for the diagnosis of pulmonary tuberculosis in Brazilian patients with and without HIV infection.,"BACKGROUND: Direct smear examination with Ziehl-Neelsen (ZN) staining for the diagnosis of pulmonary tuberculosis (PTB) is cheap and easy to use, but its low sensitivity is a major drawback, particularly in HIV seropositive patients. As such, new tools for laboratory diagnosis are urgently needed to improve the case detection rate, especially in regions with a high prevalence of TB and HIV. OBJECTIVE: To evaluate the performance of two in house PCR (Polymerase Chain Reaction): PCR dot-blot methodology (PCR dot-blot) and PCR agarose gel electrophoresis (PCR-AG) for the diagnosis of Pulmonary Tuberculosis (PTB) in HIV seropositive and HIV seronegative patients. METHODS: A prospective study was conducted (from May 2003 to May 2004) in a TB/HIV reference hospital. Sputum specimens from 277 PTB suspects were tested by Acid Fast Bacilli (AFB) smear, Culture and in house PCR assays (PCR dot-blot and PCR-AG) and their performances evaluated. Positive cultures combined with the definition of clinical pulmonary TB were employed as the gold standard. RESULTS: The overall prevalence of PTB was 46% (128/277); in HIV+, prevalence was 54.0% (40/74). The sensitivity and specificity of PCR dot-blot were 74% (CI 95%; 66.1%-81.2%) and 85% (CI 95%; 78.8%-90.3%); and of PCR-AG were 43% (CI 95%; 34.5%-51.6%) and 76% (CI 95%; 69.2%-82.8%), respectively. For HIV seropositive and HIV seronegative samples, sensitivities of PCR dot-blot (72% vs 75%; p=0.46) and PCR-AG (42% vs 43%; p=0.54) were similar. Among HIV seronegative patients and PTB suspects, ROC analysis presented the following values for the AFB smear (0.837), Culture (0.926), PCR dot-blot (0.801) and PCR-AG (0.599). In HIV seropositive patients, these area values were (0.713), (0.900), (0.789) and (0.595), respectively. CONCLUSION: Results of this study demonstrate that the in house PCR dot blot may be an improvement for ruling out PTB diagnosis in PTB suspects assisted at hospitals with a high prevalence of TB/HIV."
Folgueira L and Delgado R and Palenque E and Aguado JM and Noriega AR,Journal of clinical microbiology,1996,NA,10.1128/JCM.34.3.512-515.1996,NA,8904404,NA,"Adult and Aged and Bacteremia/*diagnosis and DNA, Bacterial/blood and Female and Humans and Male and Middle Aged and Mycobacterium tuberculosis/*isolation & purification and *Polymerase Chain Reaction",NA,"Journal Article and Research Support, Non-U.S. Gov't",Rapid diagnosis of Mycobacterium tuberculosis bacteremia by PCR.,"A method based on DNA amplification and hybridization has been used for the rapid detection of Mycobacterium tuberculosis in blood samples from 38 hospitalized patients (15 human immunodeficiency virus [HIV] positive and 23 HIV negative) in whom localized or disseminated forms of tuberculosis were suspected. In 32 of these patients, the diagnosis of tuberculosis was eventually confirmed by conventional bacteriological or histological procedures. M. tuberculosis DNA was detected with the PCR technique in the peripheral blood mononuclear cells from 9 of 11 (82%) HIV-infected patients and in 7 of 21 (33%) HIV-negative patients (P < 0.01), while M. tuberculosis blood cultures were positive in 1 of 8 (12.5%) and 1 of 18 (5.5%) patients, respectively. PCR was positive in all cases with disseminated disease in both HIV-negative and HIV-positive patients and also in the HIV-positive patients with extrapulmonary tuberculosis. Seven samples from patients with documented illness other than tuberculosis and 12 specimens from healthy volunteers, including seven volunteers with a recent positive purified protein derivative test, were used as controls and had a negative PCR. These results suggest that detection of M. tuberculosis DNA in peripheral blood mononuclear cells may be a useful tool for rapid diagnosis of disseminated and extrapulmonary forms of tuberculosis, especially in an HIV-positive population."
Lyra JM and Maruza M and Verza M and Carneiro MM and Albuquerque Mde F and Rossetti ML and Ximenes R and Braga MC and Lucena-Silva N,Memorias do Instituto Oswaldo Cruz,2014,NA,10.1590/0074-0276130542,NA,25317709,NA,"Bacterial Load and Coinfection and DNA Primers and HIV and HIV Infections/*blood and Humans and *Immunocompromised Host and Lung/microbiology and Molecular Diagnostic Techniques/*methods and *Mycobacterium tuberculosis/growth & development and Reagent Kits, Diagnostic/standards and Real-Time Polymerase Chain Reaction/methods and Sensitivity and Specificity and Sputum/*microbiology and Tuberculosis, Pulmonary/blood/*diagnosis",NA,Evaluation Study and Journal Article,Evaluation of four molecular methods for the diagnosis of tuberculosis in pulmonary and blood samples from immunocompromised patients.,"The present study analysed the concordance among four different molecular diagnostic methods for tuberculosis (TB) in pulmonary and blood samples from immunocompromised patients. A total of 165 blood and 194 sputum samples were collected from 181 human immunodeficiency virus (HIV)-infected patients with upper respiratory complaints, regardless of suspicious for TB. The samples were submitted for smear microscopy, culture and molecular tests: a laboratory-developed conventional polymerase chain reaction (PCR) and real-time quantitative PCR (qPCR) and the Gen-Probe and Detect-TB Ampligenix kits. The samples were handled blindly by all the technicians involved, from sample processing to results analysis. For sputum, the sensitivity and specificity were 100% and 96.7% for qPCR, 81.8% and 94.5% for Gen-Probe and 100% and 66.3% for Detect-TB, respectively. qPCR presented the best concordance with sputum culture [kappa (k) = 0.864)], followed by Gen-Probe (k = 0.682). For blood samples, qPCR showed 100% sensitivity and 92.3% specificity, with a substantial correlation with sputum culture (k = 0.754) and with the qPCR results obtained from sputum of the corresponding patient (k = 0.630). Conventional PCR demonstrated the worst results for sputa and blood, with a sensitivity of 100% vs. 88.9% and a specificity of 46.3% vs. 32%, respectively. Commercial or laboratory-developed molecular assays can overcome the difficulties in the diagnosis of TB in paucibacillary patients using conventional methods available in most laboratories."
Crump JA and Tuohy MJ and Morrissey AB and Ramadhani HO and Njau BN and Maro VP and Reller LB and Procop GW,Journal of clinical microbiology,2012,NA,10.1128/JCM.05963-11,NA,22031703,NA,"Adolescent and Adult and Aged and Aged, 80 and over and Bacteremia/*diagnosis/microbiology and Bacteriological Techniques/*methods and Blood/*microbiology and Humans and Middle Aged and Mycobacterium tuberculosis/genetics/*isolation & purification and Real-Time Polymerase Chain Reaction/*methods and Sensitivity and Specificity and Specimen Handling/*methods and Tuberculosis/*diagnosis/microbiology and Young Adult",NA,"Evaluation Study and Journal Article and Research Support, N.I.H., Extramural and Research Support, Non-U.S. Gov't",Performance of nucleic acid amplification following extraction of 5 milliliters of whole blood for diagnosis of Mycobacterium tuberculosis bacteremia.,"To investigate the performance of a nucleic acid amplification test (NAAT) for the diagnosis of Mycobacterium tuberculosis bacteremia, 5-ml aliquots of blood were inoculated into bioMrieux mycobacterial (MB) bottles and incubated, and 5-ml aliquots of blood were extracted and tested by real-time PCR. Of 25 samples from patients with M. tuberculosis bacteremia, 9 (36.0%) were positive and 1 (1.5%) of 66 control samples was positive by NAAT. The NAAT shows promise, but modifications should focus on improving sensitivity."
