author,journal,year,document_type,doi,url,pubmed_id,author_keywords,mesh_terms,keywords,publication_type,title,abstract
Kolk AH and Kox LF and Kuijper S and Richter C,"Lancet (London, England)",1994,NA,10.1016/s0140-6736(94)92135-0,NA,7915390,NA,"DNA, Bacterial/*blood/genetics and Gene Amplification and Humans and Immunocompromised Host and Mycobacterium tuberculosis/genetics/*isolation & purification and *Polymerase Chain Reaction and Tuberculosis/*diagnosis/microbiology",NA,Comment and Letter,Detection of Mycobacterium tuberculosis in peripheral blood.,NA
Click ES and Murithi W and Ouma GS and McCarthy K and Willby M and Musau S and Alexander H and Pevzner E and Posey J and Cain KP,Scientific reports,2018,NA,10.1038/s41598-017-17683-6,NA,29330384,NA,"Adult and Cell-Free Nucleic Acids/*genetics and DNA, Bacterial/*blood and Female and Humans and Male and Mycobacterium tuberculosis/*genetics and Real-Time Polymerase Chain Reaction and Sensitivity and Specificity and Sputum/microbiology and Tuberculosis/blood/*diagnosis",NA,"Journal Article and Research Support, U.S. Gov't, Non-P.H.S.",Detection of Apparent Cell-free M. tuberculosis DNA from Plasma.,"New diagnostics are needed to improve clinicians' ability to detect tuberculosis (TB) disease in key populations such as children and persons living with HIV and to rapidly detect drug resistance. Circulating cell-free DNA (ccfDNA) in plasma is a diagnostic target in new obstetric and oncologic applications, but its utility for diagnosing TB is not known. Here we show that Mycobacterium tuberculosis complex DNA can be detected in plasma of persons with sputum smear-positive TB, even in the absence of mycobacteremia. Among 40 participants with bacteriologically-confirmed smear-positive TB disease who had plasma tested by quantitative PCR (qPCR), 18/40 (45%) had a positive result on at least one triplicate reaction. Our results suggest that plasma DNA may be a useful target for improving clinicians' ability to diagnose TB. We anticipate these findings to be the starting point for optimized methods of TB ccfDNA testing and sequence-based diagnostic applications such as molecular detection of drug resistance."
Ndlovu Z and Fajardo E and Mbofana E and Maparo T and Garone D and Metcalf C and Bygrave H and Kao K and Zinyowera S,PloS one,2018,NA,10.1371/journal.pone.0193577,NA,29499042,NA,Adult and Anti-Retroviral Agents/therapeutic use and Automation and Feasibility Studies and Female and HIV Infections/*diagnosis/drug therapy/virology and HIV-1/metabolism and Humans and Male and *Point-of-Care Systems and Sputum/microbiology and Tuberculosis/*diagnosis/microbiology and Viral Load and Zimbabwe,NA,"Journal Article and Research Support, Non-U.S. Gov't",Multidisease testing for HIV and TB using the GeneXpert platform: A feasibility study in rural Zimbabwe.,"BACKGROUND: HIV Viral Load and Early Infant Diagnosis technologies in many high burden settings are restricted to centralized laboratory testing, leading to long result turnaround times and patient attrition. GeneXpert (Cepheid, CA, USA) is a polyvalent near point-of-care platform and is widely implemented for Xpert MTB/RIF diagnosis. This study sought to evaluate the operational feasibility of integrated HIV VL, EID and MTB/RIF testing in new GeneXpert platforms. METHODS: Whole blood samples were collected from consenting patients due for routine HIV VL testing and DBS samples from infants due for EID testing, at three rural health facilities in Zimbabwe. Sputum samples were collected from all individuals suspected of TB. GeneXpert testing was reserved for all EID, all TB suspects and priority HIV VL at each site. Blood samples were further sent to centralized laboratories for confirmatory testing. GeneXpert polyvalent testing results and patient outcomes, including infrastructural and logistical requirements are reported. The study was conducted over a 10-month period. RESULTS: The fully automated GeneXpert testing device, required minimal training and biosafety considerations. A total of 1,302 HIV VL, 277 EID and 1,581 MTB/RIF samples were tested on a four module GeneXpert platform in each study site. Xpert HIV-1 VL testing was prioritized for patients who presented with advanced HIV disease, pregnant women, adolescents and suspected ART failures patients. On average, the study sites had a GeneXpert utilization rate of 50.4% (Gutu Mission Hospital), 63.5% (Murambinda Mission Hospital) and 17.5% (Chimombe Rural Health Centre) per month. GeneXpert polyvalent testing error rates remained lower than 4% in all sites. Decentralized EID and VL testing on Xpert had shorter overall median TAT (1 day [IQR: 0-4] and 1 day [IQR: 0-1] respectively) compared to centralized testing (17 days [IQR: 13-21] and 26 days [IQR: 23-32] respectively). Among patients with VL >1000 copies/ml (73/640; 11.4%) at GMH health facility, median time to enhanced adherence counselling was 8 days and majority of those with documented outcomes had re-suppressed VL (20/32; 62.5%). Median time to ART initiation among Xpert EID positive infants at GMH was 1 day [IQR: 0-1]. CONCLUSION: Implementation of near point-of-care GeneXpert platform for integrated multi-disease testing within district and sub-district healthcare settings is feasible and will increase access to VL, and EID testing to priority populations. Quality management systems including monitoring of performance indicators, together with regular on-site supervision are crucial, and near-POC test results must be promptly actioned-on by clinicians for patient management."
Moore CC and Jacob ST and Banura P and Zhang J and Stroup S and Boulware DR and Scheld WM and Houpt ER and Liu J,Clinical infectious diseases : an official publication of the Infectious Diseases and Society of America,2019,NA,10.1093/cid/ciy472,NA,29868873,NA,Adult and Cytomegalovirus/*isolation & purification and Cytomegalovirus Infections/*blood and Female and Hospital Mortality and Humans and Male and Molecular Diagnostic Techniques and Polymerase Chain Reaction and Sepsis/*epidemiology/*etiology and Tuberculosis/*blood and Uganda,NA,"Journal Article and Research Support, N.I.H., Extramural",Etiology of Sepsis in Uganda Using a Quantitative Polymerase Chain Reaction-based TaqMan Array Card.,"BACKGROUND: Knowledge of causes of sepsis in sub-Saharan Africa is limited. A better understanding of the microbiology of bloodstream infections could improve outcomes. METHODS: We used a quantitative polymerase chain reaction (qPCR)-based TaqMan Array Card (TAC) to directly test for 43 targets from whole blood. We analyzed 336 cryopreserved specimens from adult Ugandans with sepsis enrolled in a multisite study; 84% were infected with human immunodeficiency virus. We compared qPCR TAC results with blood culture and determined the association of qPCR with study participant outcomes using logistic regression. RESULTS: The most frequently detected targets were cytomegalovirus (CMV, n = 139, 41%), Mycobacterium tuberculosis (TB, n = 70, 21%), Plasmodium (n = 35, 10%), and Streptococcus pneumoniae (n = 31, 9%). Diagnostic performance varied by target with qPCR sensitivity averaging 61  28% and specificity 98  3% versus culture. In multivariable analysis, independent factors associated with in-hospital mortality included CMV viremia (adjusted odds ratio [aOR] 3.2, 95% confidence interval [CI], 1.8-5.5; p < .01) and TB qPCR-positivity, whether blood culture-positive (aOR 4.6, 95% CI, 2.1-10.0; p < .01) or blood culture-negative (aOR 2.9, 95% CI, 1.2-6.9; p = .02). CONCLUSIONS: Using qPCR TAC on direct blood specimens, CMV and TB were the most commonly identified targets and were independently associated with increased in-hospital mortality. qPCR TAC screening of blood for multiple targets may be useful to guide triage and treatment of sepsis in sub-Saharan Africa."
Santos FCF and Lira LAS and Montenegro RA and Lima JFDC and Lima AS and Schindler HC and Montenegro LML,Revista da Sociedade Brasileira de Medicina Tropical,2018,NA,10.1590/0037-8682-0372-2017,NA,29972564,NA,"DNA, Bacterial/*analysis/genetics/isolation & purification and Double-Blind Method and Humans and Mycobacterium tuberculosis/*genetics/isolation & purification and Prospective Studies and Real-Time Polymerase Chain Reaction and Reproducibility of Results and Sensitivity and Specificity and Tuberculosis/*diagnosis",NA,Evaluation Study and Journal Article,Performance of the IS6110-TaqMan assay in the diagnosis of extrapulmonary tuberculosis from different biological samples.,"INTRODUCTION: This study evaluated the performance of the IS6110-TaqMan assay in different types of biological samples and tissues for laboratory diagnosis of extrapulmonary tuberculosis. METHODS: 143 biological samples and tissues from patients with suspected extrapulmonary tuberculosis from the health services of Recife/Pernambuco/Brazil were evaluated with the IS6110-TaqMan assay. RESULTS: The sensitivities of the IS6110-TaqMan assay calculated for blood, urine, both blood and urine samples, tissue biopsies, extrapulmonary body fluid samples, and all samples from patients calculated together were 55.9%, 33.3%, 68.8%, 43.8%, 29.6%, and 73.7%, respectively, and the specificities were 80%, 100%, 78.6%, 100%, 100%, and 84.2%, respectively. CONCLUSIONS: The accuracy of qPCR was high in various clinical sample types. The analysis of more than one type of clinical sample collected from the same patient with extrapulmonary tuberculosis enhances the diagnostic power of the IS6110-TaqMan assay when compared with the use of only one clinical sample."
Paine SK and Basu A and Choudhury RG and Bhattacharya B and Chatterjee S and Bhattacharya C,Molecular diagnosis & therapy,2018,NA,10.1007/s40291-018-0322-3,NA,29549658,NA,"Adult and Asymptomatic Diseases and Bacterial Typing Techniques/methods and Cohort Studies and DNA Primers/chemical synthesis/metabolism and DNA, Bacterial/*genetics/isolation & purification and Endometrium/surgery and Female and Humans and Infertility, Female/complications/*diagnosis/microbiology/pathology and Laparoscopy and Menstruation/blood and Multiplex Polymerase Chain Reaction/*methods and Mycobacterium tuberculosis/classification/*genetics/isolation & purification and Tuberculosis, Female Genital/complications/*diagnosis/microbiology/pathology",NA,"Journal Article and Research Support, Non-U.S. Gov't",Multiplex PCR from Menstrual Blood: A Non-Invasive Cost-Effective Approach to Reduce Diagnostic Dilemma for Genital Tuberculosis.,"AIM: Genital tuberculosis (GTB) is a potent contributor to irreversible damage to the reproductive system and infertility in females. As no gold standard diagnostic tool is yet available, clinical suspicion and relatively insensitive approaches such as histopathology, laparoscopy and hysterosalpingogram are currently critical determinants in the diagnosis of GTB. Although apolymerase chain reaction (PCR)-based assay using endometrial tissue seems promising, sampling doesrequire an invasive procedure. OBJECTIVE: We hypothesized that menstrual blood may provide an alternate non-invasive source of samples for PCR-based GTB diagnosis. METHODS: We enrolled 195 women with primary infertility in whom GTB was suspected. We obtained ethics committee approval from our institution and written informed consent from subjects. Endometrial tissue and menstrual blood was collected from the subjects and culture, histopathology, and multiplex PCR with both sample type was performed for each subject. RESULTS: The sensitivity and specificity of multiplex PCR was, respectively, 90.2 and 86.1% for menstrual blood, 95.8 and 84.3% for endometrial tissue, and 64.8 and 93.2% for histopathology staining. CONCLUSIONS: A strong clinical suspicion aided with multiplex PCR using menstrual blood may significantly reduce the diagnostic dilemma for GTB diagnosis in a non-invasive, sensitive, rapid, and cost-effective manner."
Pohl C and Rutaihwa LK and Haraka F and Nsubuga M and Aloi F and Ntinginya NE and Mapamba D and Heinrich N and Hoelscher M and Marais BJ and Jugheli L and Reither K,The Journal of infection,2016,NA,10.1016/j.jinf.2016.04.041,NA,27394403,NA,"Blood/*microbiology and Child and Child, Preschool and Female and HIV Infections/complications/epidemiology/microbiology/virology and Humans and Male and Microscopy and Mycobacterium tuberculosis/*isolation & purification and Prospective Studies and Sensitivity and Specificity and Sputum/microbiology and Tanzania/epidemiology and Tuberculosis/complications/*diagnosis/epidemiology/*microbiology and Tuberculosis, Pulmonary/complications/*diagnosis/epidemiology/*microbiology and Uganda/epidemiology and World Health Organization",*Childhood and *Diagnosis and *Tuberculosis and *Whole blood and *Xpert MTB/RIF,Evaluation Study and Journal Article,Limited value of whole blood Xpert() MTB/RIF for diagnosing tuberculosis in children.,"OBJECTIVES: We evaluated the ability of the Xpert() MTB/RIF assay to detect Mycobacterium tuberculosis in whole blood of children with tuberculosis in tuberculosis endemic settings with high rates of HIV infection. METHODS: From June 2011 to September 2012 we prospectively enrolled children with symptoms or signs suggestive of tuberculosis at three research centres in Tanzania and Uganda. After clinical assessment, respiratory specimens were collected for microscopy and culture, as well as whole blood for Xpert() MTB/RIF. Children were classified according to standardised case definitions. RESULTS: A total of 232 children were evaluated; 14 (6.0%) had culture-confirmed tuberculosis. The Xpert() MTB/RIF assay detected M. tuberculosis in 5/232 (2.2%) blood samples with 1 (0.4%) error reading and presumably 1 (0.4%) false-positive result. The sensitivity of the assay in children with culture-confirmed (1/14) versus no tuberculosis (1/117) was 7.1% (95% CI, 1.3-31.5). Three of the five Xpert() MTB/RIF positive patients had negative cultures, but were classified as probable tuberculosis cases. Assay sensitivity against a composite reference standard (culture-confirmed, highly probable or probable tuberculosis) was 5.4% (95% CI, 2.1-13.1). CONCLUSION: Whole blood Xpert() MTB/RIF demonstrated very poor sensitivity, although it may enhance the diagnostic yield in select cases, with culture-negative tuberculosis."
Bwanga F and Disqu C and Lorenz MG and Allerheiligen V and Worodria W and Luyombya A and Najjingo I and Weizenegger M,BMC infectious diseases,2015,NA,10.1186/s12879-015-0785-3,NA,25656799,NA,Adolescent and Adult and Blood Specimen Collection/*methods/standards and *Blood Volume and Cross-Sectional Studies and Female and Germany and HIV Infections/*blood/complications/microbiology and Humans and Male and Molecular Diagnostic Techniques/methods and Mycobacterium tuberculosis/*isolation & purification and *Polymerase Chain Reaction/methods/standards and Sensitivity and Specificity and Tuberculosis/blood/*diagnosis/microbiology and Young Adult,NA,"Journal Article and Observational Study and Research Support, Non-U.S. Gov't",Higher blood volumes improve the sensitivity of direct PCR diagnosis of blood stream tuberculosis among HIV-positive patients: an observation study.,"BACKGROUND: Blood stream tuberculosis (TB), caused by Mycobacterium tuberculosis (MTB) is common among HIV-positive patients, turning rapidly fatal unless detected and treated promptly. Blood culture is currently the standard test for the detection of MTB in whole blood but results take weeks; patients deteriorate markedly and often die before a diagnosis of blood stream TB is made. Rapid molecular tests on whole blood, with potential for same day diagnosis of blood stream TB usually show low sensitivity due to the problem of insufficient MTB DNA template when extraction is performed directly on low blood volumes. This study assessed the influence of blood volume on the sensitivity of a HyBeacon PCR assay-the FluoroType MTB (Hain Lifescience, Nehren, Germany) on direct detection of MTB in whole blood. METHODS: Prospective recruitment of HIV-positive patients with clinical suspicion of blood stream TB but not on anti-TB or HIV drug treatment was done. Venous blood samples were collected and DNA extracted using the MolYsis (Molzym, Bremen, Germany) methods; for study A, from duplicate 1 ml (42 patients) and for study B (31 patients) from 9 ml EDTA blood samples. The FluoroType MTB PCR assay targeting an IS6110 sequence was performed and results compared with blood culture. RESULTS: The diagnostic sensitivity and specificity of the FluoroType MTB PCR in study A was 33% and 97%, respectively. Corresponding values in study B were 71% and 96%, respectively. In both studies, one case each of blood culture-negative blood stream TB was detected with the FluoroType MTB PCR assay. The median time to positivity of blood culture was 20.1 (range 12-32) for study A and 19.9 days (range 15-30) for study B. CONCLUSION: Larger blood volumes (9 ml) improved and gave acceptable sensitivity of direct PCR diagnosis of blood stream TB."
Dubey A and Gwal R and Agrawal S,The international journal of tuberculosis and lung disease : the official journal of and the International Union against Tuberculosis and Lung Disease,2013,NA,10.5588/ijtld.12.0536,NA,24025388,NA,"Adolescent and Adult and Aged and Aged, 80 and over and Child and Child, Preschool and Female and Humans and Leukocytes, Mononuclear/microbiology and Male and Middle Aged and Mycobacterium tuberculosis/*isolation & purification and Polymerase Chain Reaction/*methods and Predictive Value of Tests and Retrospective Studies and Sensitivity and Specificity and Time Factors and Tuberculosis/*diagnosis and Young Adult",NA,"Journal Article and Research Support, Non-U.S. Gov't",Mycobacterium tuberculosis detection in blood using multiplex nested polymerase chain reaction.,"SETTING: Polymerase chain reaction (PCR) offers great promise for the rapid, sensitive and specific diagnosis of tuberculosis (TB). However, blood TB PCR is still not standardised. OBJECTIVE: Evaluation of the Blacklight Card to standardise TB PCR in blood samples using a multiplex nested PCR method targeting insertion sequence 6110 and MPB64 sequence for use as an auxiliary tool in the diagnosis of TB. DESIGN: The study focused on the standardisation of the Blacklight Card as a new extraction tool and its evaluation using 130 blood samples randomly collected from patients with clinical symptoms of TB. RESULTS: Of 130 cases, PCR was positive in 22 samples (17%). The overall sensitivity and specificity of the PCR assay was respectively 95.7% and 100%; the positive and negative predictive values were respectively 85.1% and 99.2%. CONCLUSION: These results suggest that for the detection of Mycobacterium tuberculosis DNA in peripheral blood mononuclear cells, the Blacklight Card may be a useful tool for the rapid diagnosis of disseminated and extra-pulmonary forms of TB as well as in difficult-to-diagnose cases in which a diagnosis is urgently needed due to the severity of the patient's status."
Ushio R and Yamamoto M and Nakashima K and Watanabe H and Nagai K and Shibata Y and Tashiro K and Tsukahara T and Nagakura H and Horita N and Sato T and Shinkai M and Kudo M and Ueda A and Kaneko T,"Tuberculosis (Edinburgh, Scotland)",2016,NA,10.1016/j.tube.2016.04.004,NA,27450004,NA,"Adult and Aged and Aged, 80 and over and Case-Control Studies and DNA Copy Number Variations and DNA Gyrase/genetics and DNA, Bacterial/*blood and Female and Gene Dosage and Genetic Markers and Humans and Male and Middle Aged and Mycobacterium tuberculosis/*genetics and Polymerase Chain Reaction/*methods and Predictive Value of Tests and Reproducibility of Results and Tuberculosis, Pulmonary/blood/*diagnosis/microbiology and Young Adult",*Circulating DNA and *Digital PCR and *IS6110 and *Plasma and *Tuberculosis and *gyrB,Journal Article,Digital PCR assay detection of circulating Mycobacterium tuberculosis DNA in pulmonary tuberculosis patient plasma.,"Nucleic acid amplification tests are a major diagnostic tool for pulmonary tuberculosis (PTB). Recently, digital PCR (dPCR) assay has improved sensitivity for the detection of small copy numbers of target molecules. The aim of this study is to explore the utility of dPCR for detecting Mycobacterium tuberculosis (MTB) DNA in PTB patient plasma. Total DNA was purified from plasma samples of newly diagnosed sputum smear-positive PTB patients. Copy numbers of MTB-specific genes in the samples were quantified with dPCR assays targeted for IS6110 or gyrB. A total of 33 PTB patients were enrolled. Significant differences between PTB patients and controls were observed in copy numbers of both targets: IS6110 meanSD, 144.8538.3 vs 0.440.49 (copies/20L, p=0.004; Mann-Whitney U test) and gyrB meanSD, 359.02116 vs 0.070.28 (copies/20L, p=0.011; Mann-Whitney U test), respectively. This test had sensitivities of 65% or 29% and a specificity of 93% or 100% with the IS6110-targeted or gyrB-targeted assays, respectively. A dPCR assay successfully detected MTB DNA in PTB patient plasma. This minimally invasive and accurate method has potential to become an alternative diagnostic option."
Shenai S and Amisano D and Ronacher K and Kriel M and Banada PP and Song T and Lee M and Joh JS and Winter J and Thayer R and Via LE and Kim S and Barry CE 3rd and Walzl G and Alland D,Journal of clinical microbiology,2013,NA,10.1128/JCM.01743-13,NA,24108610,NA,"Adult and Bacteriological Techniques/*methods and Body Fluids/*microbiology and Humans and Molecular Diagnostic Techniques/*methods and Mycobacterium tuberculosis/genetics/*isolation & purification and Sensitivity and Specificity and Tuberculosis, Pulmonary/*diagnosis/*microbiology",NA,"Comparative Study and Evaluation Study and Journal Article and Research Support, Non-U.S. Gov't",Exploring alternative biomaterials for diagnosis of pulmonary tuberculosis in HIV-negative patients by use of the GeneXpert MTB/RIF assay.,"The utility of the GeneXpert MTB/RIF (Xpert) assay for detection of Mycobacterium tuberculosis in sputum samples has been extensively studied. However, the performance of the Xpert assay as applied to other readily accessible body fluids such as exhaled breath condensate (EBC), saliva, urine, and blood has not been established. We used the Xpert assay to test EBC, saliva, urine, and blood samples from HIV-negative, smear- and culture-positive pulmonary tuberculosis (TB) patients for the presence of M. tuberculosis. To compare the ability of the assay to perform bacterial load measurements on sputum samples with versus without sample processing, the assay was also performed on paired direct and processed sputum samples from each patient. The Xpert assay detected M. tuberculosis in none of the 26 EBC samples (sensitivity, 0.0%; 95% confidence interval [95% CI], 0.0%, 12.9%), 10 of the 26 saliva samples (sensitivity, 38.5%; 95% CI, 22.4%, 57.5%), 1 of 26 urine samples (sensitivity, 3.8%; 95% CI, 0.7%, 18.9%), and 2 of 24 blood samples (sensitivity, 8.3%; 95% CI, 2.3%, 25.8%). For bacterial load measurements in the different types of sputum samples, the cycle thresholds of the two M. tuberculosis-positive sputum types were well correlated (Spearman correlation of 0.834). This study demonstrates that the Xpert assay should not be routinely used to detect M. tuberculosis in EBC, saliva, urine, or blood samples from HIV-negative patients suspected of having pulmonary tuberculosis. As a test of bacterial load, the assay produced similar results when used to test direct versus processed sputum samples. Sputum remains the optimal sample type for diagnosing pulmonary tuberculosis in HIV-negative patients with the Xpert assay."
Banada PP and Koshy R and Alland D,Journal of clinical microbiology,2013,NA,10.1128/JCM.00332-13,NA,23678063,NA,Bacteremia/*diagnosis and Bacteriological Techniques/*methods and Centrifugation/methods and Humans and Molecular Diagnostic Techniques/*methods and Mycobacterium tuberculosis/genetics/*isolation & purification and Sensitivity and Specificity and Specimen Handling/methods and Tuberculosis/*diagnosis,NA,"Evaluation Study and Journal Article and Research Support, N.I.H., Extramural",Detection of Mycobacterium tuberculosis in blood by use of the Xpert MTB/RIF assay.,"We have developed a novel blood lysis-centrifugation approach for highly sensitive Mycobacterium tuberculosis detection in large volumes of blood with the Xpert MTB/RIF assay. One through 20 ml of blood was spiked with 0.25 to 10 CFU/ml of the M. tuberculosis surrogate M. bovis BCG. Multiple replicates of each sample were processed by a new lysis-centrifugation method and tested with the Xpert MTB/RIF assay. The assay was very sensitive with increased blood volumes. In the 20-ml samples, BCG was detected in blood spiked with 10, 5, 1, and 0.25 CFU/ml 100, 100, 83, and 57% of the time, respectively, compared to 100, 66, 18, and 18%, of the time, respectively, in 1-ml blood samples. Assay sensitivity was influenced by the type of anticoagulant used, with acid-citrate-dextrose solution B (ACD-B) providing the best results. A limit of detection of 10 CFU/ml was established with BCG spiked into ACD-B-treated blood, and 92, 36, and 33% of the samples with 5, 1, and 0.5 CFU/ml, respectively, were assay positive. The lysis buffer was stable both at room temperature and at 4C for 2 months. The assay was tested with blood stored for 8 days without a change in sensitivity as measured by cycle threshold. This new assay format extends the capability of the Xpert MTB/RIF test, enabling up to 20 ml of blood to be tested rapidly for the presence of M. tuberculosis. This approach may be a useful method to detect extrapulmonary tuberculosis and the risk of death in immunocompromised patients."
