author,journal,year,document_type,doi,url,pubmed_id,author_keywords,mesh_terms,keywords,publication_type,title,abstract
Chakravorty S and Tyagi JS,FEMS microbiology letters,2001,NA,10.1111/j.1574-6968.2001.tb10933.x,NA,11728724,NA,"Animals and Body Fluids/chemistry/microbiology and Cattle and DNA, Bacterial/analysis/isolation & purification and Guinea Pigs and Humans and *Isothiocyanates/chemistry and Mycobacterium tuberculosis/genetics/isolation & purification and Polymerase Chain Reaction/methods/standards and Sensitivity and Specificity and Tuberculosis/diagnosis/microbiology and Tuberculosis, Bovine and Tuberculosis, Pulmonary",NA,"Evaluation Study and Journal Article and Research Support, Non-U.S. Gov't",Novel use of guanidinium isothiocyanate in the isolation of Mycobacterium tuberculosis DNA from clinical material.,"Nucleic acid amplification technologies offer great promise for the rapid, sensitive and specific diagnosis of tuberculosis. However, the isolation of inhibitor-free DNA from biological specimens is a bottleneck of the PCR assay. Here we describe a simple method for the isolation of PCR-amplifiable DNA of Mycobacterium tuberculosis from all types of samples of pulmonary and extrapulmonary origin tested. Briefly, it involves concentration of the bacilli by high-speed centrifugation, removal of PCR inhibitors by a wash solution containing guanidinium isothiocyanate and the release of bacterial DNA by heating in the presence of detergents and Chelex-100 resin. The entire process is accomplished within approximately 3 h. The method has been validated on 780 samples of human, bovine and guinea pig origin including sputum, cerebrospinal fluid, pulmonary fluids, pus, fine needle aspirate, tissue, blood and milk."
Aguado JM and Rebollo MJ and Palenque E and Folgueria L,"Lancet (London, England)",1996,NA,10.1016/s0140-6736(96)91656-6,NA,8667949,NA,"DNA, Bacterial/*blood and Humans and Mycobacterium tuberculosis/*isolation & purification and *Polymerase Chain Reaction and Tuberculosis, Pulmonary/*diagnosis",NA,Letter,Blood-based PCR assay to detect pulmonary tuberculosis.,NA
Kikuchi Y and Oka S and Kimura S and Mitamura K and Shimada K,"Internal medicine (Tokyo, Japan)",1992,NA,10.2169/internalmedicine.31.1016,NA,1477460,NA,"AIDS-Related Opportunistic Infections and Adolescent and Adult and Base Sequence and DNA, Bacterial/isolation & purification and Drug Therapy, Combination and Ethambutol/therapeutic use and Female and HIV-1 and Humans and Isoniazid/therapeutic use and Male and Molecular Sequence Data and Mycobacterium tuberculosis and Polymerase Chain Reaction and Rifampin/therapeutic use and Sensitivity and Specificity and Tuberculosis/complications/*diagnosis/drug therapy",NA,"Case Reports and Journal Article and Research Support, Non-U.S. Gov't",Clinical application of the polymerase chain reaction for a rapid diagnosis of Mycobacterium tuberculosis infection.,"A gene amplification method of Mycobacterium tuberculosis DNA by the polymerase chain reaction (PCR) has been devised. A primer pair used in this study is 5'GTTGCCGTGGCGG TATCGG3' and 5'GCGACATTACGGGGCAGGTGG3', which brackets a 152-base region encoding the 65KD antigen, and a specific probe is 5'TTTGGGGTCATCTTTGGAGCG3'. The procedure could be completed within 2 days. The specificity and the sensitivity of the PCR for M. tuberculosis complex in identifying M. tuberculosis complex did not conflict with the conventional methods at all. Using this method, we could diagnose three cases of the disease, which had been very difficult to diagnose by the conventional methods, by detecting the DNA from the blood, liver biopsy specimen, lung aspirate, and pleural effusion."
Palenque E and Rebollo MJ and Aguado JM,"Lancet (London, England)",1994,NA,10.1016/s0140-6736(94)91681-0,NA,7934401,NA,"AIDS-Related Opportunistic Infections/*diagnosis and Adult and Bacteremia/*microbiology and Base Sequence and DNA Probes and DNA, Bacterial/*genetics and Humans and Male and Mycobacterium bovis/genetics and Mycobacterium tuberculosis/*genetics and Polymerase Chain Reaction and Tuberculosis/*diagnosis",NA,Case Reports and Comment and Letter,Amplification of Mycobacterium tuberculosis from peripheral blood.,NA
Nakatani SM and Burger M and Assef MC and Brockelt SR and Cogo LL and Messias-Reason IJ,European journal of clinical microbiology & infectious diseases : official and publication of the European Society of Clinical Microbiology,2004,NA,10.1007/s10096-004-1236-z,NA,15558344,NA,"Acquired Immunodeficiency Syndrome/complications and Adolescent and Adult and Child and DNA, Bacterial/blood/*isolation & purification and Female and Humans and Male and Middle Aged and Mycobacterium Infections/diagnosis and Mycobacterium avium Complex/*isolation & purification and Mycobacterium tuberculosis/*isolation & purification and Polymerase Chain Reaction and Sensitivity and Specificity",NA,"Journal Article and Research Support, Non-U.S. Gov't",Efficient method for mycobacterial DNA extraction in blood cultures aids rapid PCR identification of Mycobacterium tuberculosis and Mycobacterium avium.,"The study presented here evaluated the utility of several methods of extracting mycobacterial nucleic acids from positive blood culture samples and examined the effect of each method on the performance of an in-house PCR used directly in the peripheral blood of 80 patients with AIDS to identify Mycobacterium spp. The modified Boom method for extracting DNA from blood cultures proved to be the most efficient, with subsequent PCR analysis yielding 100% positivity (7 samples positive for M. avium and 5 for M. tuberculosis). Only three of 12 patients with a positive blood culture had a PCR result positive for M. avium in peripheral blood. The identification of mycobacteria by PCR in blood culture took about 3 days, reducing the time to diagnosis by several weeks. These results demonstrate that PCR is a sensitive and quick method for identifying mycobacteria, especially when a good DNA extraction method is applied."
Stauffer F and Haber H and Rieger A and Mutschlechner R and Hasenberger P and Tevere VJ and Young KK,Journal of clinical microbiology,1998,NA,10.1128/JCM.36.3.614-617.1998,NA,9508282,NA,Bronchi/microbiology and DNA Probes and Evaluation Studies as Topic and False Negative Reactions and Humans and Mycobacterium/classification/genetics/*isolation & purification and Mycobacterium avium Complex/classification/isolation & purification and Mycobacterium tuberculosis/classification/isolation & purification and Nontuberculous Mycobacteria/classification/isolation & purification and Polymerase Chain Reaction/*methods and Sensitivity and Specificity and Sputum/microbiology,NA,Journal Article,Genus level identification of mycobacteria from clinical specimens by using an easy-to-handle Mycobacterium-specific PCR assay.,"An easy-to-handle Mycobacterium-specific PCR assay for detection of the presence of a wide range of mycobacterial species in clinical samples was evaluated. The performance of the genus probe was compared with the performance of probes specific for Mycobacterium tuberculosis and Mycobacterium avium and with that of standard culture. In addition, the utility of an internal control in monitoring amplification inhibitors was studied. Of 545 respiratory and 325 nonrespiratory specimens (a total of 870 specimens), 58 (6.7%) showed the presence of amplification inhibitors, as determined by a negative result for the internal control. Of these 58 specimens, 31 (53%) were stool specimens; other material, even citrate blood after lysis of erythrocytes, did not pose a problem with regard to inhibition of PCR amplification. Eighty-one of the remaining 812 specimens had a positive Mycobacterium culture result. Of these culture-positive specimens, 58 (71.6%) showed a positive result with the Mycobacterium genus-specific probe. Seventy-two samples had a positive result with the Mycobacterium-specific probe but a negative culture result. Of these 72 samples, 26 samples were regarded as true positive, either because the M. tuberculosis- or M. avium-specific probe was also positive at the same time or because other specimens from the same patient taken at the same time were culture positive. The sensitivity of the Mycobacterium-specific probe was 78.5% and the specificity was 93.5%. This study showed that pretesting of clinical specimens for mycobacteria to the genus level with a Mycobacterium-specific probe offers the routine clinical laboratory the possibility of detecting tuberculous and nontuberculous mycobacteria with one test. Furthermore, specimens testing positive with the genus-specific probe can be immediately identified with species-specific probes."
Murugesan K and Hogan CA and Palmer Z and Reeve B and Theron G and Andama A and Somoskovi A and Steadman A and Madan D and Andrews J and Croda J and Sahoo MK and Cattamanchi A and Pinsky BA and Banaei N,Journal of clinical microbiology,2019,NA,10.1128/JCM.00782-19,NA,31511335,NA,"Adult and Bacteria and Blood Specimen Collection and Body Fluids/microbiology/virology and Cell-Free Nucleic Acids/*blood/*urine and DNA, Bacterial/blood/*isolation & purification/urine and DNA, Fungal/blood/*isolation & purification/urine and DNA, Viral/blood/*isolation & purification/urine and Female and Fungi and Healthy Volunteers and Humans and Male and Middle Aged and Specimen Handling and Viruses and Young Adult",*PCR and *cell-free DNA and *liquid biopsy and *preanalytical,"Journal Article and Research Support, Non-U.S. Gov't",Investigation of Preanalytical Variables Impacting Pathogen Cell-Free DNA in Blood and Urine.,"Pathogen cell-free DNA (pcfDNA) in blood and urine is an attractive biomarker; however, the impact of preanalytical factors is not well understood. Blood and urine samples from healthy donors spiked with cfDNA from Mycobacterium tuberculosis, Salmonella enterica, Aspergillus fumigatus, and Epstein-Barr virus (EBV) and samples from tuberculosis patients were used to evaluate the impact of blood collection tube, urine preservative, processing delay, processing method, freezing and thawing, and sample volume on pcfDNA. The PCR cycle threshold (C(T) ) was used to measure amplifiable cfDNA. In spiked samples, the median C(T) values for M. tuberculosis, S. enterica, and EBV cfDNA were significantly lower in blood collected in K(2)EDTA tubes than those in Streck and PAXgene blood collection tubes, and they were was significantly lower in urine preserved with EDTA (EDTA-urine) than in urine preserved with Streck reagent (Streck-urine). Blood and urine samples from TB patients preserved with K(2)EDTA and Tris-EDTA, respectively, showed significantly lower median M. tuberculosis C(T) values than with the Streck blood collection tube and Streck urine preservative. Processing delay increased the median pathogen C(T) values for Streck and PAXgene but not K(2)EDTA blood samples and for urine preserved with Streck reagent but not EDTA. Double-spin compared with single-spin plasma separation increased the median pathogen C(T) regardless of blood collection tube. No differences were observed between whole urine and supernatant and between fresh and thawed plasma and urine after 24weeks at -80C. Larger plasma and urine volumes in contrived and patient samples showed a significantly lower median M. tuberculosis C(T) These findings suggest that large-volume single-spin K(2)EDTA-plasma and EDTA-whole urine with up to a 24-h processing delay may optimize pcfDNA detection."
"Lawn, S.D. and Kerkhoff, A.D.",International Journal of Tuberculosis and Lung Disease,2015,Letter,10.5588/ijtld.15.0837,https://www.scopus.com/inward/record.uri?eid=2-s2.0-84948984936&doi=10.5588%2fijtld.15.0837&partnerID=40&md5=fa37bff45643449c6b72d00c4aea8935,26614206,NA,NA,"Africa south of the Sahara;  assay;  bacteremia;  bacterium culture;  blood culture;  cohort analysis;  diagnostic test;  human;  Human immunodeficiency virus;  Human immunodeficiency virus infected patient;  Letter;  major clinical study;  morbidity;  mortality;  Mycobacterium tuberculosis;  priority journal;  prospective study;  South Africa;  tuberculosis;  bacteremia;  complication;  isolation and purification;  Mycobacterium tuberculosis;  tuberculosis, Bacteremia;  Humans;  Mycobacterium tuberculosis;  Tuberculosis",NA,Rapid diagnosis of TB in HIV-positive inpatients with M. tuberculosis bacteraemia in sub-Saharan Africa,NA
"Sankar, S. and Vadivel, K. and Nandagopal, B. and Jesudason, M.V. and Sridharan, G.",Molecular Diagnosis and Therapy,2014,Article,10.1007/s40291-013-0079-7,https://www.scopus.com/inward/record.uri?eid=2-s2.0-84902352912&doi=10.1007%2fs40291-013-0079-7&partnerID=40&md5=c18326b2d9ba62633c35a732c3c4f61c,24385404,NA,NA,"adolescent;  adult;  article;  bacterium detection;  blood sampling;  Burkholderia pseudomallei;  child;  colony forming unit;  female;  fever;  genome;  human;  India;  lung tuberculosis;  major clinical study;  male;  Mycobacterium tuberculosis;  polymerase chain reaction;  priority journal;  Salmonella typhi;  aged;  bacterial infection;  Burkholderia pseudomallei;  genetics;  infant;  isolation and purification;  melioidosis;  microbiology;  middle aged;  Mycobacterium tuberculosis;  pathology;  polymerase chain reaction;  preschool child;  procedures;  pyrexia idiopathica;  Salmonella enterica subsp. enterica serovar Typhi;  tuberculosis;  typhoid fever;  very elderly;  young adult, bacterial DNA, Adolescent;  Adult;  Aged;  Aged, 80 and over;  Bacterial Infections;  Burkholderia pseudomallei;  Child;  Child, Preschool;  DNA, Bacterial;  Female;  Fever of Unknown Origin;  Humans;  India;  Infant;  Male;  Melioidosis;  Middle Aged;  Mycobacterium tuberculosis;  Polymerase Chain Reaction;  Salmonella typhi;  Tuberculosis;  Typhoid Fever;  Young Adult",NA,"A multiplex nested PCR for the simultaneous detection of Salmonella typhi, Mycobacterium tuberculosis, and Burkholderia pseudomallei in patients with pyrexia of unknown origin (PUO) in Vellore, South India","Background and Objectives: Salmonella typhi, Mycobacterium tuberculosis, and Burkholderia pseudomallei are among the most important monocyte-tropic bacterial agents causing pyrexia of unknown origin (PUO), with a significant number of endemic infections in both South and Southeast Asian regions. These infections pose a major risk to travelers to these regions as well. Methods: We developed and evaluated a multiplex nested polymerase chain reaction (PCR) for the simultaneous detection of the three pathogens in 305 patients' buffy coat samples. Results: The assay for S. typhi and B. pseudomallei was able to detect down to 1 colony forming unit/5 L PCR input and M. tuberculosis was detected down to 20 genome copies/5 L PCR input. S. typhi was detected in 10 (3.3 %) individuals, B. pseudomallei in 10 individuals (3.3 %), and M. tuberculosis in 18 individuals (5.9 %). Co-infections of M. tuberculosis and B. pseudomallei were detected in three individuals and S. typhi and B. pseudomallei in two individuals. Conclusion: This protocol is efficient for PUO diagnosis especially in Asian countries.  2013 Springer International Publishing."
"da Cruz, H.L.A. and de Albuquerque Montenegro, R. and de Arajo Lima, J.F. and da Rocha Poroca, D. and da Costa Lima, J.F. and Montenegro, L.M.L. and Crovella, S. and Schindler, H.C.",Brazilian Journal of Microbiology,2011,Article,10.1590/s1517-83822011000100041,https://www.scopus.com/inward/record.uri?eid=2-s2.0-79551566682&doi=10.1590%2fs1517-83822011000100041&partnerID=40&md5=8e0362c391dfcc6ba1304ddccfc24425,NA,Blood;  IS6110 insertion sequence;  Molecular diagnosis;  Mycobacterium tuberculosis;  Nested-PCR;  Urine,NA,Bacilli (class);  Mycobacterium tuberculosis,NA,Evaluation of a nested-PCR for mycobacterium tuberculosis detection in blood and urine samples,"The polymerase chain reaction (PCR) and its variations, such as the nested-PCR, have been described as promising techniques for rapid diagnosis of tuberculosis (TB). With the aim of evaluating the usefulness of a nested-PCR method on samples of blood and urine of patients suspected of tuberculosis we analyzed 192 clinical samples, using as a molecular target the insertion element IS6110 specific of M. tuberculosis genome. Nested-PCR method showed higher sensitivity in patients with extrapulmonary tuberculosis (47.8% and 52% in blood and urine) when compared to patients with the pulmonary form of the disease (sensitivity of 29% and 26.9% in blood and urine), regardless of the type of biological sample used. The nested-PCR is a rapid technique that, even if not showing a good sensitivity, should be considered as a helpful tool especially in the extrapulmonary cases or in cases where confirmatory diagnosis is quite difficult to be achieved by routine methods. The performance of PCR-based techniques should be considered and tested in future works on other types of biological specimens besides sputum, like blood and urine, readily obtainable in most cases. The improving of M. tuberculosis nested-PCR detection in TB affected patients will give the possibility of an earlier detection of bacilli thus interrupting the transmission chain of the disease."
"Rolfs, A. and Beige, J. and Finckh, U. and Kohler, B. and Schaberg, T. and Lokies, J. and Lode, H.",Journal of Clinical Microbiology,1995,Article,10.1128/jcm.33.12.3312-3314.1995,https://www.scopus.com/inward/record.uri?eid=2-s2.0-0028825880&doi=10.1128%2fjcm.33.12.3312-3314.1995&partnerID=40&md5=a849f3cdd415541a4e97bbf8dd75209f,8586724,NA,NA,"bacterial DNA, article;  clinical trial;  diagnostic value;  double blind procedure;  human;  human cell;  lung tuberculosis;  major clinical study;  monocyte;  Mycobacterium tuberculosis;  polymerase chain reaction;  priority journal;  prospective study, Bacteria (microorganisms);  Mycobacterium;  Mycobacterium tuberculosis",NA,Amplification of Mycobacterium tuberculosis from peripheral blood,"To determine the value of the PCR assay of lymphomonocytic blood cells for the diagnosis of pulmonary tuberculosis, we compared, in a prospective study, PCR results with results of conventional diagnostic methods of Mycobacterium tuberculosis detection. Clinical investigators who were unaware of the PCR data classified 162 immunocompetent patients, who had been hospitalized because of suspected pulmonary tuberculosis, in accordance with the recommendations of the American Thoracic Society (ATS). By testing blood samples from these patients for mycobacterial DNA with three different PCR systems, we were able to demonstrate that nonquantitative PCR of peripheral blood leukocytes is of little value for the specific diagnosis of pulmonary tuberculosis. However, semiquantitative PCR assays might have some significance since we found an increasing level of mycobacterial DNA copies in blond from patients classified in ATS groups 2 to 5."
"Schluger, N.W. and Condos, R. and Lewis, S. and Rom, W.N.",The Lancet,1994,Article,10.1016/S0140-6736(94)92999-8,https://www.scopus.com/inward/record.uri?eid=2-s2.0-0028308866&doi=10.1016%2fS0140-6736%2894%2992999-8&partnerID=40&md5=fffe5c18d44158904c87aafd04ddf1ee,7913158,NA,NA,"bacterial dna, article;  blood sampling;  clinical article;  clinical trial;  controlled clinical trial;  controlled study;  gene amplification;  human;  lung tuberculosis;  mycobacterium tuberculosis;  polymerase chain reaction;  priority journal, DNA, Bacterial;  Gene Amplification;  Humans;  Mycobacterium tuberculosis;  Polymerase Chain Reaction;  Tuberculosis, Pulmonary",NA,Amplification of DNA of Mycobacterium tuberculosis from peripheral blood of patients with pulmonary tuberculosis,"Sputum examination for rapid diagnosis of pulmonary tuberculosis is not always satisfactory. We examined peripheral blood with the polymerase chain reaction (PCR). Blood samples were collected from 8 consecutive patients with suspected pulmonary tuberculosis and from 18 healthy controls, half of whom were tuberculin skin-test positive. All 8 patients had evidence of circulating Mycobacterium tuberculosis DNA in the lymphocyte fraction of peripheral blood, and positive sputum cultures indicating active pulmonary tuberculosis. None of the healthy controls had positive PCR results. This PCR technique may prove useful for the rapid diagnosis of tuberculosis. Lancet 1994; 344: 232-33.  1994."
"Kox, L.F.F. and Rhienthong, D. and Miranda, A.M. and Udomsantisuk, N. and Ellis, K. and Van Leeuwen, J. and Van Heusden, S. and Kuijper, S. and Kolk, A.H.I.",Journal of Clinical Microbiology,1994,Article,10.1128/jcm.32.3.672-678.1994,https://www.scopus.com/inward/record.uri?eid=2-s2.0-0028157985&doi=10.1128%2fjcm.32.3.672-678.1994&partnerID=40&md5=54cfec25b0467fc55f4e44d0b1b0aee6,8195377,NA,NA,"bacterial DNA;  chloroform;  deoxyuridine triphosphate derivative;  DNA polymerase;  glycosyltransferase;  phenol;  proteinase;  thiocyanate;  thymidine triphosphate, article;  bacterium detection;  blood sampling;  cerebrospinal fluid;  contamination;  diagnostic accuracy;  DNA purification;  feces;  gene amplification;  human;  human tissue;  Mycobacterium tuberculosis;  pleura fluid;  polymerase chain reaction;  priority journal;  pus;  sputum analysis, Bacillariophyta;  Bacteria (microorganisms);  Mycobacterium;  Mycobacterium tuberculosis",NA,A more reliable PCR for detection of Mycobacterium tuberculosis in clinical samples,"Diagnostic techniques based on PCR have two major problems: false-positive reactions due to contamination with DNA fragments from previous PCRs (amplicons) and false-negative reactions caused by inhibitors that interfere with the PCR. We have improved our previously reported PCR based on the amplification of a fragment of the Mycobacterium tuberculosis complex- specific insertion element IS6110 with respect to both problems. False- positive reactions caused by amplicon contamination were prevented by the use of uracil-N-glycosylase and dUTP instead of dTTP. We selected a new set of primers outside the region spanned by the formerly used primers to avoid false-positive reactions caused by dTTP-containing amplicons still present in the laboratory. With this new primer set, 16 copies of the IS6110 insertion element, the equivalent of two bacteria, could be amplified 1010 times in 40 cycles, resulting in a mean efficiency of 77% per cycle. To detect the presence of inhibitors of the Taq polymerase, which may cause false-negative reactions, part of each sample was spiked with M. tuberculosis DNA. The DNA purification method using guanidinium thiocyanate and diatoms effectively removed most or all inhibitors of the PCR. However, this was not suitable for blood samples, for which we developed a proteinase K treatment followed by phenol-chloroform extraction. This method permitted detection of 20 M. tuberculosis bacteria per ml of whole blood. Various laboratory procedures were introduced to reduce failure or inhibition of PCR and avoid DNA cross contamination. We have tested 218 different clinical specimens obtained from patients suspected of having tuberculosis. The samples included sputum (n = 145), tissue biopsy samples (n = 25), cerebrospinal fluid (n = 15), blood (n = 14), pleural fluid (n = 9), feces (n = 7), fluid from fistulae (n = 2), and pus from a wound (n = 1). The results obtained by PCR were consistent with those obtained with culture, which is the 'gold standard.' We demonstrate that PCR is a useful technique for the rapid diagnosis of tuberculosis at various sites."
